<?xml version="1.0" encoding="UTF-8"?>
<tns:Service xmlns:tns="http://www.example.org/restaurants" xmlns:xsi="http://www.w3.org/2001/XMLSchema-instance" xsi:schemaLocation="http://www.example.org/restaurants restaurants.xsd ">
  <tns:restaurant>
    <tns:Name>Subway</tns:Name>
    <tns:Id>0</tns:Id>
    <tns:Menu>
      <tns:Item>
        <tns:Name>Sub</tns:Name>
        <tns:Price>5.0</tns:Price>
      </tns:Item>
      <tns:Item>
        <tns:Name>Pizza</tns:Name>
        <tns:Price>3.5</tns:Price>
      </tns:Item>
    </tns:Menu>
  </tns:restaurant>
  <tns:restaurant>
    <tns:Name>Jimmy John's</tns:Name>
    <tns:Id>1</tns:Id>
    <tns:Menu>
      <tns:Item>
        <tns:Name>Sub</tns:Name>
        <tns:Price>8.0</tns:Price>
      </tns:Item>
    </tns:Menu>
  </tns:restaurant>
</tns:Service>
